event_name,risk_category,trigger,what_it_implies
User sent chat hub message,LOW,Chat hub message sent,User interacted with chat
User set node operation or mode,LOW,Node operation changed,User configured node operation
User skipped community plus,LOW,Community plus skipped,User dismissed enrollment
User sorted insights table,LOW,Insights table sorted,User sorted analytics data
User started nodes to sub-workflow extraction,LOW,Extraction started,User began extraction
User submitted empty state builder prompt,LOW,Empty state prompt submitted,User used builder prompt
User submitted workflow generation feedback,LOW,AI feedback submitted,User provided AI feedback
User switched parameter mode,LOW,Fixed/expression mode switched,User changed parameter input mode
User tidied up canvas,LOW,Auto-arrange canvas,User organized canvas
User toggled log view,LOW,Log view toggled,User interacted with log panel
User toggled log view sub pane,LOW,Log sub pane toggled,User interacted with log panel
User toggled n8n reference option,LOW,Attribution toggled,User toggled n8n reference
User toggled sidebar,LOW,Sidebar toggled,User toggled navigation sidebar
User turned off fromAI override,LOW,fromAI disabled,User disabled AI override
User turned on fromAI override,LOW,fromAI enabled,User enabled AI override
User unpinned ndv data,LOW,Data unpinned,User removed pinned data
User updated insights time range,LOW,Insights time range changed,User adjusted analytics view
User viewed credential tab,LOW,Tab switched in credential editor,User navigated credential details — secrets remain redacted
User viewed data mapping tooltip,LOW,Mapping tooltip shown,User hovered over mapping help
User viewed node actions,LOW,Node actions viewed,User viewed node actions
User viewed node category,LOW,Category opened in panel,User browsed node categories
User viewed node settings,LOW,Settings tab viewed,User viewed node settings
User viewed personalization modal,LOW,Personalization modal shown,User viewed modal
User viewed personalization tooltip,LOW,Personalization tooltip shown,Tooltip displayed
User viewed resource center tooltip,LOW,Resource center tooltip shown,Tooltip displayed
User viewed template cell,LOW,Template card viewed,User browsed templates
User viewed template detail,LOW,Template detail viewed,User viewed template
User viewed tests tab,LOW,Tests tab viewed,User browsed tests
User visited resource center,LOW,Resource center opened,User opened resource center
User visited resource center section,LOW,Resource center section visited,User browsed section
User visited template recommendation modal tab,LOW,Template reco tab visited,User browsed tab
User visited template repo,LOW,Template repo visited,User visited templates
User was recommended personalized templates,LOW,Templates recommended,System recommended templates
Workflow builder journey,LOW,Builder journey tracking (various sub-events),User progressed through builder
Workflow diff view closed,LOW,Diff modal closed,User closed diff view
Workflow diff view opened,LOW,Diff modal opened,User viewed AI changes
ai.focusedNodes.added,LOW,Focused node added to AI,User added node focus
ai.focusedNodes.chatSent,LOW,Chat sent with focused nodes,User sent focused chat
ai.focusedNodes.removed,LOW,Focused node removed from AI,User removed node focus
user clicked cnr browse button,LOW,CNR browse button clicked,User browsed community nodes
user clicked cnr docs link,LOW,CNR docs link clicked,User viewed docs
user clicked cnr install button,LOW,CNR install button clicked,User initiated community node install
user clicked ignore suggested action,LOW,Suggestion ignored,User dismissed suggestion
user clicked ignore suggested actions for all workflows,LOW,All suggestions ignored,User dismissed all suggestions
user clicked to browse the cnr package documentation,LOW,CNR package docs browsed,User viewed package docs
user opened suggested actions checklist,LOW,Checklist opened,User viewed production checklist
user viewed cnr settings page,LOW,CNR settings viewed,User viewed community nodes
Instance FE emitted error,NONE,Frontend error,System error
Instance FE emitted paired item error,NONE,Paired item error,System error
Instance attempted to refresh license,NONE,License refresh,System license check
Instance compacted workflow history,NONE,History compaction,System maintenance
Instance failed to send transactional email to user,NONE,Email send failed,System email failure
Instance first prod failure,NONE,First production failure,Milestone event
Instance started,NONE,Server startup,System event — instance booted
Ldap general sync finished,NONE,LDAP sync completed,System sync event
Ldap login sync failed,NONE,LDAP sync failed,System error
Manual exec errored,NONE,Frontend execution error,System error tracking
Owner finished instance setup,NONE,Initial setup completed,System setup event
Session started,NONE,Session/telemetry init,System event — session began
Sso user instance role update,NONE,SSO role update,System provisioning
Sso user project access update,NONE,SSO provisioning update,System provisioning
Test run finished,NONE,Test run completed,System event
User attempted to login,NONE,Login form submitted,Auth event
User clicked invite link from email,NONE,Invite link clicked,System onboarding event
User clicked password reset link from email,NONE,Password reset link clicked,System auth event
User hit concurrency limit,NONE,Concurrency limit reached,System limit event
User hit data table storage limit,NONE,Storage limit reached,System limit event
User instance stopped,NONE,Instance shutdown,System event — instance stopped
User is part of experiment,NONE,Experiment assignment,System A/B test assignment
User login failed since ldap disabled,NONE,"Login failed, LDAP disabled",System auth event
User opened workflow from onboarding template with ID,NONE,,
User ran out of free AI credits,NONE,AI credits exhausted,System limit event
User requested password reset while logged out,NONE,Password reset requested,System auth event
User sent transactional email,NONE,Email sent successfully,System email event
User shown value survey,NONE,NPS survey shown,System event
User signed up,NONE,User completed signup,Account creation event
Workflow execution count,NONE,Periodic aggregate,System batch of execution counts
Workflow execution errored,NONE,Execution error (auto-tracked),System error tracking
Workflow first data fetched,NONE,First data fetch,Milestone event
Workflow first prod success,NONE,First production success,Milestone event
pulse,NONE,6-hour heartbeat,System pulse — no user action
